{
  "tenantId": "11111111-1111-4111-8111-111111111111",
  "actionKey": "create_ad_copy",
  "invocationId": "inv-ledger-1",
  "attempt": 1,
  "callId": "att1.WyIxMTExMTExMS0xMTExLTQxMTEtODExMS0xMTExMTExMTExMTEiLCJjcmVhdGVfYWRfY29weSIsImludi1sZWRnZXItMSIsMV0",
  "workflowKey": "copy-review",
  "agentKey": "copywriting-agent",
  "requestFingerprint": "hmac-sha256:v1:synthetic-local-v1:aaaaaaaaaaaaaaaaaaaaaaaaaaaaaaaaaaaaaaaaaaaaaaaaaaaaaaaaaaaaaaaa",
  "fingerprintKeyId": "synthetic-local-v1",
  "tenantPeriodId": "bp-a0000000000000000000000000000001",
  "workflowPeriodId": "bp-a0000000000000000000000000000002",
  "status": "reserved",
  "estimateMicroUsd": 2500,
  "actualMicroUsd": null,
  "pendingReason": null,
  "leaseSeconds": 90,
  "leaseExpiresAt": "2026-09-29T12:01:30.000000Z",
  "acquiredAt": "2026-09-29T12:00:00.000000Z",
  "closedAt": null,
  "reconciledAt": null,
  "reconciliationEvidenceRef": null
}
